Name,Description,Tactics,Type,Tier,Diff,Bonus,Attack,Distance,Damage,Effect,Major,Severe,HP,Stress,Experiences,Feature1,Action1,Text1,Quote1,Feature2,Action2,Text2,Quote2,Feature3,Action3,Text3,Quote3,Feature4,Action4,Text4,Quote4,Feature5,Action5,Text5,Quote5,Feature6,Action6,Text6,Quote6,Feature7,Action7,Text7,Quote7
Pirate Captain,"A charismatic sea dog with an impressive hat, eager to raid and plunder.","Command, Raid, Plunder, Make ‘em Walk the Plank",Leader,1,14,4,Cutlass,Melee,2d8,phy,7,14,7,5,"Sailor +3, Command +2",Swashbuckler,Passive,Any incoming damage below 14 causes the attacker to mark a Stress.,“You begin to realize: you might not win this fight.”,Reinforcements,Action,Mark a Stress to summon a Pirate Raiders Horde that enters at Far range. This can only be done once per scene.,"“The captain whistles, and more pirates pour out from the ship’s hold.”",No Quarter,Action,Spend a Fear to choose a target who has more than two pirates within melee range of them. The Captain leads the pirates in hurling threats and promises of a watery grave. The target must make a Presence Reaction Roll or suffer 1d4+1 Stress. They still mark a Stress on a success.,"“This is a battle of blades and of insults, it seems.”",,,,,,,,,,,,,,,,
Pirate Raiders,Seafaring scoundrels moving in a ravaging pack.,"Gang Up, Raid, Plunder",Horde (3/HP),1,12,1,Cutlass,Melee,2d8+5,phy,5,11,4,3,Sailor +3,Swashbuckler,Passive,Any incoming damage below 11 causes the attacker to mark a Stress.,“You begin to realize: you might not win this fight.”,Horde (2d4+3),Passive,"If a Pirate Raider has marked 2 or more of its HP, they deal 2d4+3 phy instead of their normal damage.","“With their numbers dwindling, they don’t pose as much of a threat.”",,,,,,,,,,,,,,,,,,,,
Pirate Tough,A thickly-muscled and tattooed pirate with melon-sized fists.,"Raid, Plunder, Smash, Terrorize",Bruiser,1,13,1,Massive Fists,Melee,3d4+11,phy,8,15,5,3,Sailor +2,Swashbuckler,Passive,Any incoming damage below 15 causes the attacker to mark a Stress.,“You begin to realize: you might not win this fight.”,Clear The Decks,Action,"Make an attack against a target within Very Close range. On a success, mark a Stress to move into melee with them and deal 2d6+10 damage. The target is then thrown back to a Close distance.","“The ship rocks, sending you sprawling.”",,,,,,,,,,,,,,,,,,,,
Red Ooze,A moving mound of translucent flaming red slime.,"Ignite, Start Fires, Camouflage, Consume & Multiply",Skulk,1,10,1,Ooze Appendage,Melee,2d6+3,mag,6,11,5,3,Camouflage +3,Creeping Fire,Action,This adversary can only move Very Close range when it activates. It lights any flammable object it touches on fire.,"“It creeps towards you, the ground around it erupting into flames.”",Ignite,Action,"Make an attack against a target in Very Close range. On a success, they burst into flames, taking 1d8+1 mag damage immediately and 2d4+2 direct magic damage every time a token is placed on the action tracker. This ends when they are extinguished with a Finesse Roll (14).","“You feel fire at your feet, and suddenly, you’re engulfed.”",Split,Reaction,"When this adversary marks its 3rd Hit Point, spend a Fear to split it into two Tiny Red Oozes (with no marked Hit Points or Stress). They may immediately activate without spending tokens.",“You watch as the damage you’ve done splits it in half… becoming two oozes instead of one.”,,,,,,,,,,,,,,,,
Rotted Zombie,A decaying corpse ambling toward its prey.,"Hunger, Maul, Surround, Eat Flesh",Standard,1,8,-3,Bite,Melee,4,phy,,,1,1,,Minion (4),Passive,"This adversary is defeated if they take any damage. For every 4 damage a PC deals to this adversary, defeat an additional minion in the attack’s range.",“You hack through multiple bodies in the tight press of the undead.”,Group Attack,Action (2),"Choose a target and activate all Rotten Zombies within Close range of them. Those minions move into melee with the target and make one shared attack roll. On a success, they deal 4 phy damage each. Combine this damage together.","“Though zombies move forward mindlessly, seeming to attack in a coordinated effort of instinct.”",,,,,,,,,,,,,,,,,,,,
Sellsword,An armed mercenary testing their luck.,"Charge, Overwhelm, Lacerate, Profit",Minion,1,10,0,Longsword,Melee,4,phy,,,1,1,,Minion (4),Passive,"This adversary is defeated if they take any damage. For every 4 damage a PC deals to this adversary, defeat an additional minion in the attack’s range.","“You cut through them effortlessly, one to the next.”",Group Attack,Action (2),"Choose a target and activate all Sellswords within Close range of them. Those minions move into melee with the target and make one shared attack roll. On a success, they deal 4 phy damage each. Combine this damage together.","“They descend on you, stronger together.”",,,,,,,,,,,,,,,,,,,,
Shambling Zombie,"An animated corpse that moves shakily, driven only by hunger.","Hunger, Mob Enemy, Shred Flesh, Devour",Standard,1,10,0,Bite,Melee,1d8+7,phy,4,6,4,1,,Too Many to Handle,Passive,"If Shambling Zombie is in melee range with an opponent and at least one other Zombie is within Close range, all attacks against that opponent have advantage.",“You no longer know where to look as more zombies surround you.”,Horrifying,Passive,"When this creature deals hit point damage to a target, the target also marks Stress.",“A cold shiver goes down your spine as you face off against the corpse of someone you knew.”,,,,,,,,,,,,,,,,,,,,
Skeleton Archer,A clattering pile of bones.,"Play Dead, Overwhelm, Fall Apart, Steal Skin",Ranged,1,9,2,Shortbow,Far,2d8+3,phy,4,7,3,2,,Opportunist,Passive,"When two or more adversaries are very close to a target, all damage the archer deals to them is doubled.","“Seeing their opportunity, they pull back and let loose an arrow.”",Deadly Shot,Action,"Make an attack against a Vulnerable target within Far range. On a success, mark a Stress to deal 3d4+8 damage.","“Their arrow finds you, exploiting your vulnerability to sink itself deep.”",,,,,,,,,,,,,,,,,,,,
Skeleton Dredge,A clattering pile of bones.,"Play Dead, Overwhelm, Fall Apart, Steal Skin",Minion,1,8,-1,Bone Claws,Melee,3,phy,,,1,1,,Minion (4),Passive,"This adversary is defeated if they take any damage. For every 4 damage a PC deals to this adversary, defeat an additional minion in the attack’s range.","“You cut through them effortlessly, one to the next.”",Group Attack,Action (2),"Choose a target and activate all Skeleton Dredges within Close range of them. Those minions move into melee with the target and make one shared attack roll. On a success, they deal 3 phy damage each. Combine this damage together.","“They descend on you, stronger together.”",,,,,,,,,,,,,,,,,,,,
Skeleton Knight,A dirt-covered skeleton armed with a rusted blade.,"Gang Up, Feign Death, Steal Skin",Bruiser,1,13,2,Rusty Greatsword,Melee,2d8+5,phy,7,13,5,2,,Cut to the Bone,Action,Mark a Stress to make a Rusty Greatsword attack against all enemies within Very Close range. Each target this succeeds against takes 2d8+5 phy and marks a Stress.,“They swing their sword around them with unexpected power.”,Dig Two Graves,Reaction,"When this adversary is killed, before it dies, it makes an attack against an enemy within Very Close range (prioritizing the enemy that killed it). On success, the target takes 3d4+8 phy damage and loses 1d4 Hope.","“With its last moment of strength, the bone knight strikes out at you.”",,,,,,,,,,,,,,,,,,,,
Skeleton Warrior,A dirt-covered skeleton armed with a rusted blade.,"Gang Up, Feign Death, Steal Skin",Standard,1,10,0,Sword,Melee,2d6+2,phy,4,8,3,2,,Only Bones,Passive,This creature is resistant to physical damage.,"“Your weapon slides through their ribs, no skin to pierce. ”",Won’t Stay Dead,Reaction,"After this adversary has marked its last hit point, you may still activate it to roll 1d6. On a 6, if there are any other adversaries still on the battlefield, this adversary reforms itself and returns to battle with no hit points marked.","“The pile of bones reforms itself, rising up to fight again.”",,,,,,,,,,,,,,,,,,,,
Spellblade,A mercenary combining their skills in swordplay and magic to deadly effect.,"Blast, Command, Endure",Leader,1,14,3,Empowered Longsword,Melee,2d8+5,phy/mag,8,14,6,3,Magical Knowledge +2,Arcane Steel,Passive,Damage dealt by the Empowered Longsword is considered both physical and magic.,“Their blade glows with an otherworldly sheen.”,Suppressing Blast,Action,Mark a Stress and target a group within Far range. They must make an Agility Reaction Roll or take 1d8+1 mag damage. Add a token to the action tracker for each target that marked HP on this attack.,"“The magical blast ricochets towards you, knocking the wind out of your lungs.”",Move As A Unit,Action,Spend a Fear to activate the Spellblade and up to five allied units within Far range.,"“With sword raised high, they lead the charge towards you.”",,,,,,,,,,,,,,,,
Swarm of Rats,A skittering mass of ordinary rodents moving as one like a ravenous wave.,"Consume, Swarm, Obscure",Horde (10/HP),1,10,-3,Claws,Melee,2d6+4,phy,6,10,6,2,,In Your Face,Passive,All enemies in melee range of the swarm of rats have disadvantage on against any target other than the horde.,"“They swarm you, pulling your focus from anything but them.”",Horde (1d4+2),Action,"Once 4 HP are marked on the horde, they only do 1d4+2 on their Claws attack.","“With their numbers dwindling, they don’t pose as much of a threat.”",,,,,,,,,,,,,,,,,,,,
Sylvan Soldier,A faerie warrior adorned in leaf & bark armor.,"Ambush, Overwhelm, Protect, Trail, Hide",Standard,1,11,0,Scythe,Melee,2d6+2,phy,6,11,4,2,Tracker +2,Pack Tactics,Passive,"When making a Scythe attack, if another Sylvan Soldier is also in melee range of the target, deal 2d8+5 phy damage instead.","“When they work in packs, they’re more bold, more vicious.”",Forest Control,Action,Spend a Fear to pull down a tree within Close range. Anyone the tree might hit on its way down must make an Agility Reaction (15) or take 3d4+11 phy damage.,“They extend vines from their hands and pull the tree down with a crash.”,Blend In,Reaction,"After a successful attack, mark a Stress to become Hidden until this adversary’s next attack or a PC makes an Instinct Roll (14) to find them.","“When you look up from the attack, they are gone…”",,,,,,,,,,,,,,,,
Tangle Bramble,Individual blood-drinking tumbleweeds,"Drain, Entangle, Combine",Minion,1,11,-1,Thorns,Melee,4,phy,,,1,1,,Minion (4),Passive,"This adversary is defeated if they take any damage. For every 4 damage a PC deals to this adversary, defeat an additional minion in the attack’s range.","“You cut through them effortlessly, one to the next.”",Group Attack,Action (2),"Choose a target and activate all Tangle Brambles within Close range of them. Those minions move into melee with the target and make one shared attack roll. On a success, they deal 4 phy damage each. Combine this damage together.","“They descend on you, stronger together.”",Drain & Multiply,Reaction,"If an attack from Tangle Brambles deals HP and there are three or more Tangle Bramble Minions in Close range, combine all Tangle Bramble minions into a Tangle Bramble Swarm with HP equal to the number of minions combined.",,,,,,,,,,,,,,,,,
Tangle Bramble Swarm,"A cluster of animate, blood-drinking tumbleweeds, each the size of a large gourd.","Entangle, Immobilize, Digest",Horde (3/HP),1,12,0,Thorns,Melee,2d6+3,phy,6,11,6,3,Camouflage +2,Encumber,Reaction,"Whenever Tangle Bramble Swarm hits a PC, give them a bramble token. If a creature has any bramble tokens when they activate, they add an additional token to the action tracker when they take an action. If a creature has 3 or more bramble tokens, they are Restrained. Bramble tokens can be removed by making a Finesse roll (12 + the number of bramble tokens) or dealing Major damage to Tangle Bramble Swarm. If removed without damage, create a Tangle Bramble Minion in Melee with the now-freed character for each token removed.","“The brambles grab a hold of you, digging in and slowing your movement.”",Crush,Action,Mark Stress to deal 2d6+8 phy direct damage to a target with 3 or more bramble tokens.,"“The brambles dig into you, blood draining into the vegetable matter.”",Horde 1d4+2,Passive,"If Tangle Brambles has 3 or more of their Hit Points marked, their attack only deals 1d4+2 damage.","“With their numbers dwindling, they don’t pose as much of a threat.”",,,,,,,,,,,,,,,,
Tiny Green Ooze,A small moving mound of translucent green slime.,"Creep up, Envelop, Camouflage, Consume & Multiply",Skulk,1,14,-1,Ooze Appendage,Melee,1d4+1,mag,4,,2,1,,Acidic Form,Passive,Any successful melee attacks this creature makes also marks an Armor Slot on the target. This doesn’t reduce any damage.,"“The residue eats away at your armor, corroding it slowly.”",,,,,,,,,,,,,,,,,,,,,,,,
Tiny Red Ooze,A small moving mound of translucent flaming red slime.,"Blaze, Camouflage, Consume & Multiply",Skulk,1,11,-1,Ooze Appendage,Melee,1d4+2,mag,5,,2,1,,Burning,Reaction,Any creature that damages this adversary from melee range takes 2d6 direct magic damage.,"“As you strike the ooze, you feel a flash of red hot heat wash over you.”",,,,,,,,,,,,,,,,,,,,,,,,
Weaponmaster,A clear serpent with a head the size of a human that leaves behind a glass shard trail wherever it goes.,"Climb, Feed, Keep Distance, Scare",Bruiser,1,14,2,Greatsword,Very Close,2d8+5,phy,8,15,6,3,,Goading Strike,Action,"Make a Greatsword attack and mark a Stress to taunt the target. The next time the taunted target acts, if they attack anyone other than the Weaponmaster, its with disadvantage.",“They smile at you with venom in their eyes. ‘Come get me.’”,Adrenaline Burst,Action,Spend a Fear once per scene to heal 2 HP and 2 Stress.,"“They wipe the blood from their face and look up at you, revelling in the challenge.”",,,,,,,,,,,,,,,,,,,,
Young Dryad,An imperious tree-person leading their forest’s defenses.,"Command, Nurture, Prune the Unwelcome",Leader,1,11,0,Scythe,Melee,2d8+5,phy,6,11,4,2,Leadership +3,Voice of the Forest,Action,Mark a Stress to activate 1d4 allies in range of a target they can immediately hit. Their attacks deal half damage.,"“When they work in packs, they’re more bold, more vicious.”",Thorny Cage,Action,Spend a Fear to form a cage around a target within Very Close range that makes them Restrained. Any action taken against the cage marks a Stress. The target can be broken free with a successful Strength Roll.,"“A cage of thorns and vines wraps around you, holding you in place.”",,,,,,,,,,,,,,,,,,,,
Zombie Pack,A group of shambling corpses instinctively moving together.,"Hunger, Maul, Consume Flesh",Horde (2/HP),1,8,-1,Bite,Melee,2d6+8,phy,6,12,6,3,,Overwhelm,Reaction,"When a creature within melee range deals 1 HP to the Zombie Pack, you may mark a Stress to have the Zombie Pack immediately make an attack against that creature.",“The zombie's numbers seem insurmountable.”,Horde (2d4+3),Passive,"If the Zombie Pack has 3 or more of their Hit Points marked, their attack only deals 2d4+3 damage.","“With their numbers dwindling, they don’t post as much of a threat.”",,,,,,,,,,,,,,,,,,,,
Apprentice Assassin,A dirt-covered skeleton armed with a rusted blade.,"Gang Up, Feign Death, Steal Skin",Minion,2,13,-1,Thrown Dagger,Very Close,5,phy,,,1,1,Intrusion +2,Minion (6),Passive,"This adversary is defeated if they take any damage. For every 6 damage a PC deals to this adversary, defeat an additional minion in the attack’s range.","“You cut through them effortlessly, one to the next.”",Group Attack,Action (2),"Choose a target and activate all Apprentice Assassins within Close range of them. Those minions move into melee with the target and make one shared attack roll. On a success, they deal 5 phy damage each. Combine this damage together.","“They descend on you, stronger together.”",,,,,,,,,,,,,,,,,,,,
Archer Squadron,A group of trained archers bearing massive bows.,"Volley Fire, Stick Together, Survive",Horde (2/HP),2,13,0,Longbow,Far,2d6+13,phy,8,16,4,3,,Focused Volley,Action (2),Pick a point within a Far distance. Make an attack with advantage against all targets within a Close distance of that point. Targets that are hit suffer 2d10+4 phy damage.,"“Their arrows fill the air, blocking out light as they rain death upon you.”",Suppressing Fire,Action,"Mark a Stress to target a point within a Far distance. Until the next roll with Fear, any character that moves within Close of that point must make a Reaction Roll (Agility 13) or suffer 2d6+13 physical damage. On a success, they take half damage.","“They concentrate their attention on a single point, loosing on anyone that approaches.”",Horde (2d6+3),Passive,"If Archer Squadron has marked ½ or more of their HP, their basic attack deals 2d6+3 phy instead of 2d6+13 phy.","“With their numbers flagging, the archers’ attacks are weaker.”",,,,,,,,,,,,,,,,
Assassin Poisoner,A cunning scoundrel skilled in both poisons and ambushing.,"Anticipate, Taint Food and Water, Disable, Get Paid",Skulk,2,14,3,Poisoned Throwing Dagger,Close,2d8+12,phy,8,16,4,4,Intrusion +2,Grindletooth Poison,Passive,Targets that mark HP from a Poisoned Throwing Dagger attack are made Vulnerable until they clear one Hit Point.,“Your wound stings as poison courses through your body.”,Out of Nowhere,Passive,Assassin Poisoner has advantage on attacks if they are Hidden.,"“They come at you from your flank, and you barely have time to react.”",Fumigation,Action,"Drop a smoke bomb that fills the area within Close range with smoke, making all targets Dizzied. Dizzied characters add two tokens to the action tracker when they act, then are no longer dizzied.","“They throw something, and the air fills with a thick, cloying smoke.”",,,,,,,,,,,,,,,,
Battle Box,A cube-shaped construct with a different rune on each of their six sides.,"Wait in Disguise, Trample Foes, Change Tactics",Solo,2,15,2,Slam,Melee,2d6+3,phy,10,20,7,6,Camouflage +2,Relentless (2),Passive,This adversary may activate twice in a GM move.,“They move with incredible speed.”,Overcharge,Reaction,Mark a Stress to add +1d10 to the damage of any of the Battle Box’s attacks.,"“The box glows and rattles, unleashing a powerful attack.”",Randomized Tactics,Action,"Mark Stress and roll 1d6. The Battle Box uses the corresponding move. 1. Mana Beam The cube turns and fires a searing beam. Make an attack against a target within Far range. On a success, deal 2d10+10mag damage. 2. Fire Jets The cube shoots into the air, spinning as it releases jets of flame. Make an attack against all targets within Close range. Any you succeed against take 2d6+3 phy damage. 3. Trample The cube rockets around a Close area, attacking all within. Any it is successful against take 2d8+10 physical damage and are Vulnerable until their next roll with Hope. 4. Shocking Gas The cube sprays out a silver gas sparking with lightning. All creatures within Close range must make a Finesse Reaction Roll (15) or mark 3 Stress. 5. Stunning Clap The cube leaps and its sides clap, creating a small sonic boom. Any targets within Very Close range must make a Strength Reaction Roll or become Vulnerable until this adversary is defeated. 6. Psionic Whine The cube releases a cluster of mechanical bees whose buzz rattles mortal minds. All targets within Close range must make a Presence Reaction Roll (15) or take 2d8+10 mag damage that can’t be reduced by armor.","“The box jumps and spins, and unleashes a different attack depending on the side that landed face-up.”",Death Quake,,"When this adversary marks its last Hit Point, the magic powering it ruptures in an explosion of force. All targets in Close range make an Instinct Reaction Roll or take 2d8+12 magic damage.",,,,,,,,,,,,,
Chaos Skull,A bleached floating humanoid skull animated by scintillating magic.,"Serve Creator, Cackle, Consume Magic",Ranged,2,15,2,Energy Blast,Close,1d8+3,mag,8,16,5,4,,Levitation,Passive,Chaos Skull levitates several feet off the ground and can’t be Restrained.,“The skull floats at eye-level and slips out of your grasp.”,Wards,Passive,Chaos Skull is resistant to magic damage.,"“The skull absorbs part of your magic, the attack landing without the force you’d expect.”",Magic Burst,Action,Mark Stress to make an attack against all targets within Close range. Each target you succeed against takes 2d10+4 mag damage.,"“Power bursts from the skull, searing and chilling and shocking you all at once.”",Siphon Magic,Action,"Spend a Fear to make an attack against a target within Very Close range. On a success, a target with a Spellcast trait marks 1d4 Stress and the Chaos Skull clears that many Stress. Additionally, on a success, Chaos Skull may immediately activate again without spending action tokens.","“The skull cackles in a hollow voice, and you feel the magical power within slipping away from you and feeding the skull.”",,,,,,,,,,,,
Conscript,Poorly-trained civilians pressed into war.,"Follow Orders, Gang Up, Survive",Minion,2,12,0,Spears,Very Close,5,phy,,,1,1,,Minion (6),Passive,"This adversary is defeated if they take any damage. For every 6 damage a PC deals to this adversary, defeat an additional minion in the attack’s range.","“You cut through them effortlessly, one to the next.”",Group Attack,Action (2),"Choose a target and activate all Conscripts within Close range of them. Those minions move into melee with the target and make one shared attack roll. On a success, they deal 5 phy damage each. Combine this damage together.","“They descend on you, stronger together.”",,,,,,,,,,,,,,,,,,,,
Courtesan,An accomplished manipulator and master of the sensual arts.,"Entice, Maneuver, Secure Patrons",Social,2,11,-3,Dagger,Melee,1d8+3,phy,7,13,3,4,"Socialite +5, Manipulation +5",Searing Glance,Reaction,"Mark a Stress when a character within Close distance makes a roll with Presence. The target must make a Presence Reaction Roll (16). If they fail, they mark 2 Stress and are Vulnerable for the remainder of the scene until they succeed on a social action against the Courtesan. If they succeed, they still mark Stress.","“Just as you make your point, they tear you apart with a tiny scoff.”",Dangerous Allure,Action,"Spend a Fear to subvert a character, convincing them to do something they want to do even if they know it’s a bad idea. If used on an NPC, it just works unless it would violate their motive. If used on a PC, the PC must make a React roll with Presence (16). If they fail, they can do as the Courtesan asks or mark 2 Stress. If they succeed, they still mark Stress. This subversion is often, but not always, romantic or physical.",,,,,,,,,,,,,,,,,,,,,
Cult Adept,An experienced mage wielding shadow and fear.,"Uncover Knowledge, Hinder Foes, Curry Favor",Support,2,14,2,Rune-covered Rod,Far,2d4+3,mag,9,18,4,5,"Fallen Lore +2, Rituals +2",Fear is Fuel,Reaction,"When a PC rolls a failure with Fear, clear a Stress. Usable up to twice per scene.","“As the fight grows more desperate, the Adept seems refreshed.”",Enervating Blast,Action,"Make a standard attack. On a success, mark a Stress to cause the target to mark Stress in addition to the normal results.",“The blast ripples across your body as you writhe in pain.”,Shroud of the Fallen,Action - Spell,"Mark a Stress to wrap an ally within Close distance in a shroud of protection. While so protected, the target has resistance to all damage.","“They conjure a dark cloud of concentrated magical shadow, which blunts some of the strength of your attacks.”",Shadow Shackles,Action - Spell,"Spend a Fear and choose a point within Far range. All targets within Close range of that point are bound up in smoky chains and become temporarily Restrained. Each time they act while within the target area, they add two action tokens to the action tracker, not one. They can break free of the restraints with a Strength roll or by spending 2 Hope.","“Thick chains of smoke wrap themselves around you, binding you in place.”",,,,,,,,,,,,
Cult Fang,A professional killer-turned-cultist.,"Isolate Prey, Capture Sacrifices, Rise in the Ranks",Skulk,2,15,2,Long Knife,Melee,2d8+10,phy,9,17,4,4,,Shadow’s Embrace,Passive,Cult Fang can climb and walk on vertical surfaces. Mark a Stress to move from one shadow to another within a Far distance.,“The Fang moves as if one with the darkness around them.”,Pick Off The Straggler,Action,"Mark a Stress to move up to a Close distance and attack. The target must make a Reaction Roll (Instinct 15) or mark 2 Stress and be teleported with the Cult Fang to a shadow within a Far distance. If the target succeeds, they still mark Stress due to visions of the dread realm between shadows.",“They leap out from a shadow to grab you and pull you away with them.”,,,,,,,,,,,,,,,,,,,,
Cult Initiate,"A Low-ranking cultist in simple robes, eager to gain power.","Follow Orders, Gain Power, Seek Forbidden Knowledge",Minion,2,13,0,Ritual Dagger,Melee,5,phy,,,1,1,,Minion (6),Passive,"This adversary is defeated if they take any damage. For every 6 damage a PC deals to this adversary, defeat an additional minion in the attack’s range.","“You cut through them effortlessly, one to the next.”",Group Attack,Action (2),"Choose a target and activate all Cult Initiates within Close range of them. Those minions move into melee with the target and make one shared attack roll. On a success, they deal 5 phy damage each. Combine this damage together.","“They descend on you, stronger together.”",,,,,,,,,,,,,,,,,,,,
