Name,Description,Tactics,Type,Tier,Diff,Bonus,Attack,Distance,Damage,Effect,Major,Severe,HP,Stress,Experiences,Feature1,Action1,Text1,Quote1,Feature2,Action2,Text2,Quote2,Feature3,Action3,Text3,Quote3,Feature4,Action4,Text4,Quote4,Feature5,Action5,Text5,Quote5,Feature6,Action6,Text6,Quote6,Feature7,Action7,Text7,Quote7
Demonic Hound Pack,Unnatural hounds with ichor-slicked fur.,"Consume Flesh, Please Masters, Cause Fear",Horde (1/HP),2,15,0,Claws and Fangs,Melee,2d8+12,phy,11,23,5,3,Scent Tracking +3,Pounce,Passive,May leap up to a Close distance when moving as part of an activation.,"“They bound forward, clearing gaps and obstacles in pursuit of prey.”",Dreadhowl,Action,"Mark Stress to cause all targets within a Very Close distance to lose Hope. If not able to lose a Hope, they mark 2 Stress.",“They let loose a howl that tears at your heart.”,Horde (2d4+6),Passive,"If Demonic Hound Pack has half or more of its HP marked, their basic attack deals 2d4+6 phy damage instead of 2d8+12 phy.","“With their numbers dwindling, they don’t pose as much of a threat.”",,,,,,,,,,,,,,,,
Electric Eels,A pack of eels that encircle and electrocute.,"Avoid Larger Predators, Shock Prey, Tear Apart",Horde (2/HP),2,14,0,Shocking Bite,Melee,2d10+4,phy,10,20,5,3,,Paralyzing Shock,Action,Mark Stress to attack all targets within Very Close distance. Add one token to the action tracker for each target that marks HP.,"“The electricity courses through you, slowing your actions.”",Horde (2d4+4),Passive,"If Electric Eels have marked ½ or more of their HP, their standard attack deals 2d4+4d phy damage instead of 2d10+4.","“With their numbers dwindling, they don’t pose as much of a threat.”",,,,,,,,,,,,,,,,,,,,
Elite Soldier,An armored squire or experienced commoner looking to advance.,"Gain Glory, Make Alliances, Support Their Knight",Standard,2,15,1,Spear,Very Close,2d4+4,phy,9,18,4,3,,Vassal’s Loyalty,Reaction,"When a Knight or other noble would take damage, if the Elite Soldier is within Very Close range of the noble, mark a Stress and the Elite Soldier moves into melee to take the damage instead.","“They leap to their liege’s defense, throwing their body on your blow.”",Reinforce,Action,"Mark a Stress to move up to a Close distance to melee range of an ally. Make an attack against a very close target. On a success, deal 2d10+10 phy damage and clear a Stress on that Close ally.","“The soldier runs up to join the fight, stabbing with ferocity and bolstering their ally.”",,,,,,,,,,,,,,,,,,,,
Failed Experiment,"A magical experiment in necromancy gone wrong, leaving the zombie warped and ungainly.","Devour, Hunt, Track",Standard,2,13,1,Bite and Claw,Melee,2d6+5,phy,12,23,3,3,Copycat +3,Warped Fortitude,Passive,This creature is resistant to physical damage.,"“The dead flesh has grown tough, less responsive to your weapons.”",Overwhelm,Passive,"When a target this adversary is attacking has any allies also in Very Close range, Failed Experiment’s damage is doubled.","“The creature shuffles around to your flank, retaining some sense of tactics as it attacks where you’re weak.”",Lurching Lunge,Action,Mark a Stress to activate Failed Experiment even if they have already activated this move.,"“It leaps forward, its movements sharp and jolting like a puppet on strings.”",,,,,,,,,,,,,,,,
Giant Beastmaster,A leather-clad warrior bearing a whip and massive bow.,"Command, Maneuver, Pin Down, Make a Living, Protect Companion Animals",Leader,2,16,2,Longbow,Far,2d6+5,phy,12,24,6,5,Animal Handling +3,Pinning Strike,Action,"Make a Longbow attack against a target. On a success, the Beastmaster may also mark a Stress to pin them to a nearby surface. A pinned target is Restrained until freed with a Finesse or Strength Roll (16).",“Their arrow punches through you and pins you to the nearby terrain.”,Deadly Companion,Action,"Up to twice per scene, summon a Bear, Dire Wolf, or similar Tier 0 Beast under this adversary’s control. That beast appears at a Close range and immediately activates.","“They blow a whistle and a trained beast emerges, charging forward at the giant’s command.”",Two as One,Passive,"When this adversary activates, you can also activate a Tier 0 Beast currently under this adversary’s control.","“The beast and giant move in perfect sync, closing in together.”",,,,,,,,,,,,,,,,
Giant Brawler,An especially-muscular giant wielding a warhammer larger than a tall human.,"Overwhelm, Slam, Topple, Make a Living",Bruiser,2,15,2,Warhammer,Very Close,2d6+15,phy,14,28,7,4,Intrusion +2,Bloody Reprisal,Reaction,"When the Giant Brawler marks two or more HP, immediately make a Warhammer attack against the attacker, if they are within range. On a success, the target takes 2d6+15 phy damage.","“As soon as your blow has landed, they swing their hammer down at you in response.”",Battering Ram,Action,"Mark a Stress to have this adversary charge at an inanimate object within Close range they could feasibly smash (a wall, a cart, a market stand, etc.) and destroy it. Any targets in Very Close range of the object must make an Agility Reaction Roll (16) or take 2d4+3 phy damage from the shrapnel.","“The giant charges, shattering everything in their way.”",,,,,,,,,,,,,,,,,,,,
Giant Eagle,A giant-sized bird of prey with blood-stained talons.,"Hunt Prey, Strike Decisively, Stay Mobile",Skulk,2,14,1,Claws and Beak,Very Close,2d6+3,phy,8,19,4,4,,Flight,Passive,Giant Eagle’s Difficulty is +3 when flying.,“The eagle soars and swoops with incredible agility.”,Deadly Dive,Action,"Mark Stress to attack a target within Far range. On a success, the target takes 2d10+10 damage and is knocked over, making them Vulnerable until they next act.","“The eagle narrows itself into a feathered javelin, tearing through the sky before opening up and raking you with their claws.”",Take Off,Action (2),"Make an attack against a target within Very Close range. On a success, the target takes 2d4+3 phy damage and must make an Agility Reaction Roll or become Restrained within the eagle’s massive talons. If they are Restrained, the Eagle immediately lifts into the air to Very Far range above the battlefield while holding them. A Restrained target may make a Strength roll to escape.",,Deadly Drop,Action,"If the Eagle is holding a Restrained target and flying, they can drop them. This means the target is no longer Restrained, but they are falling. If their fall is not prevented by some means on the next action the PCs take, the target will suffer 2d20 phy damage.",,,,,,,,,,,,,
Giant Recruit,A giant fighter wearing borrowed armor.,"Overwhelm, Batter, Terrify, Make a Living",Minion,2,13,1,Warhammer,Very Close,6,phy,,,1,2,,Minion (7),Action (2),"Choose a target and activate all Giant Recruits within Close range of them. Those minions move into melee with the target and make one shared attack roll. On a success, they deal 6 phy damage each. Combine this damage together.","“They descend on you, stronger together.”",,,,,,,,,,,,,,,,,,,,,,,,
Gorgon,"A snake-headed scaled humanoid with a glowing bow, enraged that their piece has been disturbed.","Corner, Hit-and-Run, Seek Vengeance, Petrify",Solo,2,15,4,Sunsear Shortbow,Far,3d8+2,mag,13,25,8,3,Stealth +3,Relentless (2),Passive,This adversary may activate twice in a GM move.,“They move with incredible speed.”,Sunsear Arrows,Passive,Targets damaged by Sunsear Shortbow give off bright light within a Close distance until the end of the scene and cannot become Hidden without a magical effect. All attack rolls against a target glowing this way are made with advantage.,,Crown of Serpents,Attack,"Make an attack roll against a target in melee range using this adversary’s protective snakes. On a success, mark stress to deal 2d10+4 phy damage to the target, who must also mark a Stress.",,Petrifying Gaze,Reaction,"Spend a Fear when the Gorgon takes damage from an attack within Close range to force the attacker to make a Reaction roll with Instinct (15). On a failure, they begin to turn to stone, marking 1 hit point of direct damage and starting a petrification Countdown (4). This countdown ticks down every time the Gorgon is attacked. When triggered, the target must make a death move. If the Gorgon is killed, all Petrification countdowns end.",,,,,,,,,,,,,
Juvenile Flickerfly,A horse-sized insect with iridescent scales and crystalline wings moving faster than the eye can see.,"Collect Shiny Things, Hunt, Swoop",Solo,2,14,3,Wing Slash,Very Close,2d10+4,phy,13,26,7,5,,Relentless (3),Passive,Flickerfly may activate three times in one GM move (still costs 3 action tokens).,"“The Flickerfly is everywhere at once, moving with uncanny speed.”",Peerless Accuracy,Passive,"Before an attack the Juvenile Flickerfly makes, roll 1d6. On a 4+, the target's Evasion score is halved (rounded up).",“The Flickerfly moves so fast that you’re on the back foot as you try to evade.”,Mind Dance,Action,"Spend a Fear to create a magically dazzling display that grapples the minds of its targets. All creatures within Close range must make an Instinct Reaction Roll. On a failure, the target adds a token to the action tracker and the Flickerfly learns a fear the target has.","“Their shimmering wings catch the light and flash, enrapturing you and surfacing deep-seeded fears.”",Hallucinatory Breath,Reaction,"Countdown (Loop 1d6) Activate the first time the Flickerfly takes damage. When triggered, the Flickerfly breathes hallucinatory gas on all targets in front of them up to Far range. Targets must make an Instinct Reaction Roll or be tormented by fearful hallucinations. Targets whose fears are known to the Flickerfly have disadvantage on this roll. On a failure, the target marks a Stress and loses a Hope.",“The gas seeps in and your vision fills with terrifying visions that shake your confidence.”,,,,,,,,,,,,
Katari Burglar,A cunning thief with acrobatic skill and a flair for the dramatic.,"Hide, Profit, Pilfer, Evade",Skulk,2,14,3,Longbow,Far,2d4+3,phy,8,17,4,5,Acrobatics +3,Quick Hands,Action (2),"Make a claw attack against a target in Melee range. On a success, deal 1d8+2 phy damage and this adversary steals one item or consumable from the target’s inventory.","“The Katari swipes at you with their claws, and when their paw comes away, they’ve stolen something from your pouch. They flash you a satisfied smile.”",Escape Plan,Action,Mark a Stress to reveal a snare trap set by the Katari Burglar. All targets within Very Close range of the trap must make an Agility Reaction Roll (13) or be pulled off their feet and suspended upside down. They are Vulnerable and Restrained until they get free with a Finesse or Strength Roll (13).,“A snare snaps closed on you and flips you upside down. The Katari gives you a mocking wave as they make their escape.”,,,,,,,,,,,,,,,,,,,,
Knight of the Realm,A well-built soldier with heavy armor and a powerful bearing.,"Seek Glory, Show Dominance, Run Down",Leader,2,15,4,Longsword,Melee,2d10+4,phy,13,26,6,4,"Tactics +2, High Society +2, Ancient Knowledge +3",Chevalier,Passive,"Knight of the Realm has +2 difficulty when mounted. If they suffer Severe damage, they’re knocked from their mount and lose this benefit until they spend an action to re-mount.",“They’re a skilled rider and know how to use the mount’s speed and strength.”,Heavily Armored,Passive,"When the Knight of the Realm marks physical damage, reduce it by 3.",“Their heavy armor diminishes the strength of your blows.”,Cavalry Charge,Action,"If mounted, move up to a close distance and make an attack against a target within very close distance. On a success, deal 2d8+12 phy damage and the target marks Stress.","“They bear down on you, lance seeking your heart as the steed thunders forward.”",For the Realm!,Action (2),Mark a Stress to activate 1d4+1 allies. Any attacks they make in these activations deal half damage.,"“Their voice rings loud and clear, and their soldiers follow with vigor.”",,,,,,,,,,,,
Master Assassin,A seasoned killer with a threatening voice and a deadly blade.,"Ambush, Command, Dispatch, Profit",Leader,2,15,5,Serrated Dagger,Close,2d10+10,phy,12,25,7,5,"Intrusion +3, Command +3",Won’t See It Coming,Passive,Armor is half as effective against attacks made while Master Assassin is Hidden.,"“Attacking from stealth, their attack finds the gaps in your armor.”",Strike as One,Action,Mark a Stress to activate a number of Assassins equal to the Master Assassin’s unmarked Stress.,"“Their leader whistles, and a group of assassins act as one with practiced grace.”",The Subtle Blade,Reaction,"When Master Assassin successfully makes a Serrated Dagger attack against a character that is Vulnerable, spend a Fear to deal 3 Hit Points instead of rolling.","“Their eyes go black as the attack comes in, and the blade appears in your side, stabbing deep and ignoring your armor.”",,,,,,,,,,,,,,,,
Merchant Baron,An accomplished merchant with a large operation under their command.,"Abuse Power, Gather Resources, Mobilize Minions",Social,2,13,-2,Rapier,Melee,2d8+12,phy,9,19,5,3,"Trade +4, Nobility +2",Everyone Has a Price,Action,"If Merchant Baron knows a target’s motive, Spend a Fear to offer a target a dangerous bargain. If used on a PC, they must make a Reaction Roll with Presence (17). If they fail, they can mark 2 Stress or take the deal.",“The baron’s eyes glimmer as they make you an offer you dare not resist.”,Eyes Everywhere,Reaction,"Countdown (Loop 6) Activate when Merchant Baron first becomes relevant to the story. When triggered, spies learn the motive of a target character (NPC or PC).","“The merchant baron has agents throughout the land, scouring for the most valuable commodity: leverage.”",The Best Muscle Money Can Buy,Action,"Once per scene, mark Stress to summon 1d4+1 Tier I guards to enforce the Merchant Baron’s will. They appear at a Far distance.","“The Baron snaps, and a group of rough-looking toughs emerge from the back room.”",,,,,,,,,,,,,,,,
Minotaur,A massive bull-headed Firbolg with a quick temper.,"Gore, Overpower, Pursue, Navigate, Consume",Bruiser,2,16,2,Battleaxe,Very Close,2d10+10,phy,14,27,7,4,Navigation +2,Slow (2),Passive,This adversary costs 2 action tokens to activate.,"“The enemy moves slowly, but with incredible strength.”",Charging Bull,Action,"Spend a Fear to make an attack roll on a group within Very Close range. The Minotaur charges through them, making an attack. Any they succeed against are knocked back to Close range and take 2d10+10 phy damage. If they are knocked into a solid object or another creature, they take an additional 1d8+3 phy (add the damage together).","“The Minotaur lowers their head and charges, knocking you back with incredible force.”",Gore,Action,"Make an attack against a target within Very Close range, moving the Minotaur into melee with them. On a success, deal 2d6+15 phy damage to the target. Armor is only worth half its value against this attack.","“The Minotaur slashes and stabs with their huge horns, punching through your armor.”",,,,,,,,,,,,,,,,
Mortal Hunter,"An undead figure wearing a heavy leather coat, with searching eyes and a casually cruel demeanor.","Devour, Hunt, Track",Leader,2,16,5,Tear At Flesh,Very Close,2d10+11,phy,15,27,6,4,Bloodhound +3,Terrifying,Passive,"Every time this creature makes a successful attack, all PCs within Far range lose one Hope.","“They strike you with silent satisfaction, and their claws rend more than flesh as your confidence sinks.”",Deathlock,Action,Spend a Fear to put a deathlock on a target within Very Close range as the Mortal Hunter binds the target with a necrotic curse. Any attacks made by the Mortal Hunter on a deathlocked target deal direct damage. This creature can only maintain one deathlock at a time.,“They make a pattern with their hands and a sigil burns into you as it feels like something has wrapped cold hands around your heart.”,Inevitable Death,Action,Mark Stress to activate 1d4 adversaries under the Mortal Hunter’s control. They deal half damage with any attacks made in these activations.,"“The Hunter snaps, and the dead around you leap into action.”",Rampage,Reaction,"Countdown (Loop 1d6) Activate when a hostile target is spotted. When triggered, move in a straight line to somewhere in Far range, and make an attack with a +3 modifier against all enemies in the path. Deal 2d8+12 physical damage to any you succeed against.","“Hatred burns in their eyes, and they shoot forward with a blur, tearing through everything in their path.”",,,,,,,,,,,,
Royal Advisor,A high-ranking courtier with the ear of the local nobility.,"Curry Favor, Manufacture Evidence, Scheme",Social,2,12,-3,Wand,Far,1d8+3,phy,8,15,3,3,"Courtier +3, Administration +5",Devastating Retort,Passive,Any PC that rolls less than 17 on a social action against the Royal Advisor marks a Stress.,"“The courtier laughs and says, ‘I’m sure you think so, darling, but the rest of us live in the real world.’”",Bend Ears,Action,Mark a Stress to influence a NPC within Very Close distance with whispered words. That noble’s opinion on one matter shifts toward the Royal Advisor’s preference unless it is direct opposition to the target’s motives.,"“They lean in to whisper in the count’s ears, and you can see them changing their mind before your eyes.”",Scapegoat,Action,Spend a Fear to convince a target crowd or notable individual that one person or group is responsible for some problem facing the target. The target becomes hostile to the scapegoat until convinced of their innocence (Presence 17).,"“They’ve blamed you for the crime, and everyone has bought the lie.”",,,,,,,,,,,,,,,,
Secret-Keeper,"A cell leader with a direct channel to the Fallen Gods, wearing fine robes and wielding an ancient staff.","Amass Greater Power, Take Command, Plot in Secret",Leader,2,16,3,Sigil-laden Staff,Far,2d8+10,mag,13,26,6,4,"Fallen Lore +2, Coercion +2",Our Master’s Will,Reaction,"When the GM activates an ally within Far distance, Secret-Keeper may Mark Stress to add a token to the action tracker.","“The Secret-Keeper’s voice carries the weight of dread, chilling your blood.”",Seize Your Moment,Action,Spend a Fear to activate 1d4 allies to attack. Their attacks deal half damage.,"“When they call, the cultists answer, swarming to attack.”",Summoning Ritual,Reaction - Spell,"Countdown (6) Activate when a hostile target is spotted. When triggered, summon a Minor Demon within a Close distance. Each time Secret-Keeper marks HP, add the number of HP marked to this Countdown.","“Their leader’s hands glow with eerie light, chanting a ritual of summoning. Whatever they’re calling out to, it’s not good.”",Fallen Hounds,Reaction,"Once per scene, when Secret-Keeper takes Major or worse damage, mark a Stress to summon a Demonic Hound Pack. They appear at a Close distance and immediately activate (no token required).","“The Secret-Keeper reels from the blow, then throws a sulfurous pouch to the ground. From it springs a pack of monstrous hounds, eager for the hunt.”",,,,,,,,,,,,
Shark,"A large aquatic predator, always on the move.","Isolate Prey, Capture Sacrifices, Rise in the Ranks",Bruiser,2,14,2,Toothy Maw,Very Close,2d10+10,phy,14,28,7,3,Sense of Smell +3,Rending Bite,Passive,Armor is half as effective against damage from Shark’s attacks.,“The Shark’s teeth tear through your armor.”,Blood in the Water,Reaction,"When an enemy within Close distance of Shark marks HP from an attack by another creature, the Shark may spend Stress to immediately activate to move and attack that target.",“The Shark senses wounded prey and closes in to finish you off.”,,,,,,,,,,,,,,,,,,,,
Siren,A half-fish person with a shimmering scales and an irresistible voice.,"Lure Prey, Subdue with Song, Consume",Skulk,2,14,2,Distended Jaw Bite,Melee,2d6+3,phy,9,18,5,3,Song Repertoire +3,Enchanting Song,Action,"Spend a Fear to sing a song that affects all non-Siren creatures within Close distance. Targets must make an Instinct Reaction Roll (14) or become entranced. Other Sirens within a Close range of the target can mark Stress to increase the difficulty of this roll by +1 each. While entranced, a target cannot act and is Vulnerable. A character may mark 2 Stress to free themselves from this effect.","“Their song tugs at your soul, promising an end to all your troubles through sweet oblivion.”",Captive Audience,Passive,"If Siren attacks a target entranced by their song, the target takes 2d10+10 damage instead of normal damage.","“Incapacitated by the song, the Siren tears into you with incredible ferocity.”",,,,,,,,,,,,,,,,,,,,
Spectral Archer,"A ghostly fighter with an ethereal bow, unable to move on while their charge is vulnerable.","Rehash Old Battles, Protect Treasure, Move Through Solid Objects",Ranged,2,13,3,Longbow,Far,2d10+4,phy,6,14,3,3,Decades-old Knowledge +3,Ghost,Passive,"Spectral Archer has resistance to physical damage and may mark a Stress to move a Close distance through solid objects (walls, people, etc.).",“Their translucent form passes through solid objects like a hand through water.”,Pick Your Target,Action,"+1 attack modifier Mark a Stress to make an attack within Far distance that is in melee with at least two allies. On a success, the target takes 2d8+12 phy damage.","“They’ve forgotten their lives, but they remember how to find a good shot and take it.”",,,,,,,,,,,,,,,,,,,,
Spectral Captain,A ghostly commander leading their troops beyond death.,"Rally Troops, Rehash Old Battles, Move Through Solid Objects",Leader,2,16,3,Longbow,Far,2d10+10,phy,13,26,6,4,Decades-old Knowledge +2,Ghost,Passive,"Spectral Captain has resistance to physical damage and may mark a Stress to move a Close distance through solid objects (walls, people, etc.).",“Their translucent form passes through solid objects like a hand through water.”,Hold Fast,Reaction,"When Spectral allies are forced to make a Reaction roll, mark Stress to give all of them a +2 modifier on that roll.","“The captain bolsters their troops with words, helping them weather your attacks.”",Unending Battle,Action,Spend a Fear to return up to 1d4+1 ‘killed’ Spectral allies to the battle in the location where they first appeared. They have all Stress/HP cleared.,"“The commander calls for reinforcements, and the same ghosts you’ve already defeated re-appear without a scratch on them.”",,,,,,,,,,,,,,,,
Spectral Guardian,"A ghostly fighter with spears and swords, anchored by duty.","Rehash Old Battles, Protect Treasure, Move Through Solid Objects",Standard,2,15,1,Spear,Very Close,2d8+4,phy,7,15,4,3,Decades-old Knowledge +3,Ghost,Passive,"Spectral Guardian has resistance to physical damage and may mark a Stress to move a Close distance through solid objects (walls, people, etc.).",“Their translucent form passes through solid objects like a hand through water.”,Grave Blade,Action,"+0 attack modifier Make an attack against a target within very close range. On a success, deal 2d10+6 phy damage and the target must mark Stress.",“Their blades slash and stab and the wounds they leave run cold like ice.”,,,,,,,,,,,,,,,,,,,,
Spy,A skilled espionage agent with a knack for being in the right place to overhear secrets.,"Abuse Power, Gather Resources, Mobilize Minions",Skulk,2,14,-2,Dagger,Melee,2d6+3,phy,8,17,4,3,Scent Tracking +3,Fly on the Wall,Reaction,"Mark a Stress when something sensitive is discussed to reveal that the Spy is present in a scene observing a character or group. The PC with the highest Instinct or best chance to notice the Spy makes an Instinct Reaction Roll (17) to notice the Spy. If they fail, they can mark Stress to know that they’re being observed but not where the Spy is.",,Gathering Secrets,Action,"Spend a Fear to describe how the Spy knows a secret about a target character in the scene. If the target is a PC, they may mark 2 Stress to suggest a lesser secret that the Spy learned instead.",,,,,,,,,,,,,,,,,,,,,
Stonewraith,"A cousin of a mountain lion, with a slate-gray stone body.","Stalk Through Stone, Isolate Prey, Defend Territory",Skulk,2,13,3,Bite & Claws,Melee,2d8+12,phy,11,22,6,3,Stonesense +3,Stonestrider,Passive,Stonewraith can move through stone and earth as if it was sand/rough terrain. They only need to surface air once every twenty minutes and use Stonesense to identify pockets of air in tunnels and the surface.,“The beast leaps into the stone wall like it was merely sand.”,Rocky Ambush,Action,Mark a Stress as Stonewraith leaps from within stone/earth to attack a target. The target must make an Agility or Instinct Reaction Roll (15) or take 2d8+12 phy damage and become temporarily Vulnerable until they take their next action.,“They burst from the wall to tackle you to the floor and rend you with their teeth.”,Avalanche Roar,Action,Spend a Fear to roar and cause a cave-in. All targets within Close must make an Agility (14) Reaction Roll or suffer 2d10+10 phy damage. The rubble can be cleared with a Completion Countdown (8).,“Their voice resonates with the stone. The ceiling cracks and comes tumbling down all around you.”,,,,,,,,,,,,,,,,
