Name,Description,Tactics,Type,Tier,Diff,Bonus,Attack,Distance,Damage,Effect,Major,Severe,HP,Stress,Experiences,Feature1,Action1,Text1,Quote1,Feature2,Action2,Text2,Quote2,Feature3,Action3,Text3,Quote3,Feature4,Action4,Text4,Quote4,Feature5,Action5,Text5,Quote5,Feature6,Action6,Text6,Quote6,Feature7,Action7,Text7,Quote7
Acid Burrower,A horse-sized insect with digging claws and acidic blood.,"Burrow, Drag Away, Feed, Reposition",Solo,1,14,3,Claws,Very Close,2d8+5,phy,8,15,7,3,Tremor Sense +2,Relentless (2),Passive,This adversary may activate twice in a GM move.,“They move with incredible speed.”,Earth Eruption,Action,"Mark a Stress to have this adversary burst out of the ground, causing anyone within Very Close to make an Agility (14) reaction roll or be knocked over and Vulnerable until they next act.",“They burrow themselves deep and explode out from under you.”,Spit Acid,Action,"Make an attack against all targets in front of the Acid Burrower within Close range. On a success, deal 2d6+3 phy damage and make their armor score is halved until the next time they repair it.",“The acid starts to eat away at your armor.”,Acid Bath,Reaction,"When this adversary takes Severe damage, all targets within Close range are bathed in its acidic blood, dealing 2d8+5 phy damage (armor is half as effective against this damage). This splash covers the ground within a Very Close distance with acid blood, and any movement through it by another creature automatically deals 1d6 damage.","“As you strike them, you’re covered in their cold, corrosive blood.”",,,,,,,,,,,,
Archer Guards,Tall guards bearing a longbow and quiver with arrows fletched in the settlement’s colors.,"Close Gates, Pin Down, Arrest, Make it Through the Day",Ranged,1,10,1,Longbow,Far,1d8+7,phy,4,8,3,2,Local Knowledge +3,Hobbling Shot,Action,"Make an attack against a target in Far range. On a success, mark a Stress to deal 2d8+5 phy damage and give the target disadvantage on all Agility rolls until they clear at least one marked HP.","“An arrow pierces your leg, knocking you to the ground mid-stride.”",,,,,,,,,,,,,,,,,,,,,,,,
Bear,A large beast with thick fur and powerful claws.,"Climb, Defend Territory, Pummel, Track",Bruiser,1,14,1,Claws,Melee,2d8+5,phy,9,17,7,2,"Keen Senses +2, Ambusher +3",Overwhelming Force,Passive,Creatures that mark HP from this creature’s Claws attack are knocked out of melee.,“The flurry of claws send you flying backwards.”,Bite,Action,"Mark a Stress to make a bite attack against a target in melee. On a success, deal 3d4+10 damage and make them Restrained. They can escape on a Strength roll.","“A powerful bite clamps down onto you, keeping you from moving.”",,,,,,,,,,,,,,,,,,,,
Bladed Guards,Armored guards bearing a sword and shield painted in the settlement’s colors.,"Arrest, Close Gates, Pin Down, Make it Through the Day",Standard,1,12,1,Longsword,Melee,2d6+3,phy,5,9,5,2,Local Knowledge +3,Shield Wall,Passive,The difficulty to move through anywhere within Close range around this adversary is increased by 1 for each Bladed Guard within melee range of one another.,“The line of guards in an immovable wall of stubbornness and armor.”,Detain,Action,"Make an attack against a target within Very Close range. On a success, mark a Stress to make the target Restrained. They can break free on a successful attack against the adversary or on a Strength or Finesse roll.",“They hold you with an iron grip and begin to lead you away.”,,,,,,,,,,,,,,,,,,,,
Brawny Zombie,"A large corpse, decay-bloated and angry.","Destruction, Crush, Slam, Hail Debris",Bruiser,1,10,2,Slam,Very Close,2d12,phy,8,15,7,4,"Throw +4, Collateral Damage +2",Slow (2),Passive,It takes 2 action tokens to activate this adversary.,“A lumbering figure moves towards you in the darkness.”,Rip & Tear,Reaction,"On a successful attack in melee, mark a Stress to make the target Restrained and force them to mark 2 Stress (in addition to normal damage).",“The zombie grabs you and holds fast. You need to escape before it tears you apart.”,Rend Asunder,Action,"When the Brawny Zombie has a target Restrained, make an attack with advantage. On a success, armor cannot be used against this damage.","“The zombie pulls on your limbs, trying to tear you apart like an angry child with a doll.”",,,,,,,,,,,,,,,,
Cave Ogre,A massive humanoid who sees all sapient life as food.,"Throw Enemies, Bite Off Heads, Feast, Rip Limbs, Stomp",Solo,1,15,1,Club,Melee,2d8+5,phy,8,15,6,3,Throw +2,Bone Breaker,Passive,"When a PC uses an Armor Slot to reduce incoming damage from the Cave Ogre, it is only half as effective.",“The ogre can shatter armor as easily as break bones.”,Rampaging Fury,Reaction,"When this creature takes Major or Severe Damage, they rampage. Move them to somewhere within Close range and deal 2d6+3 direct physical damage to anyone they would cross through to get there.","“Enraged by your attack, the enemy charges forward.”",Hail of Boulders,Action (2),Mark a Stress to pick up heavy objects and throw them at all targets in front of the ogre up to Far range. Make an attack roll against these targets. Any you succeed against take 3d4+12 phy damage.,"“A boulder flies towards you, too large and too fast to run from.”",,,,,,,,,,,,,,,,
Construct,A roughly humanoid being of stone and steel assembled and animated by magic.,"Serve Creator, Smash Target, Destroy Environment, Trample Groups",Solo,1,13,4,Fist Slam,Melee,2d6+3,phy,7,15,9,4,,Shifting Amalgamation,Passive,Physical damage dealt to the Construct does +1 Hit Points.,“The creature’s shifting form is vulnerable to the bolts of your crossbow.”,Overload,Reaction,Mark a Stress to add +10 to a damage roll this adversary makes. Construct may then activate again.,"“The construct swells with arcane energy, powering itself up.”",Trample,Action,"When this adversary moves during an activation, mark a Stress to make an attack against all targets in its path. On a success, deal 2d6+5 physical damage.","“They run towards you with reckless abandon, stomping everything in their path.”",Death Quake,Reaction,"When this creature marks its last Hit Point, the magic powering it ruptures in an explosion of force. Make an attack against all targets within Very Close range with advantage. On a success, deal 2d4+8 magic damage.","“As it falls, the magic within ruptures and explodes.”",,,,,,,,,,,,
Courtier,An ambitious and ostentatiously dressed socialite.,"Discredit, Gain Favor, Maneuver, Scheme",Social,1,9,-4,Dagger,Melee,1d4+2,phy,4,8,2,4,Socialite +5,Mockery,Action,"Mark a Stress to say something mocking and force a target within Close range to make a Presence Reaction Roll (14) to see if they can save face. If they fail, they mark 2 Stress and are Vulnerable for the remainder of the scene.","“Was that song written out of tune, or do you just play it that way?”",Scapegoat,Action,Spend a Fear and choose a PC as the target. The courtier convinces a crowd or prominent individual that this target is the cause of their current conflict or misfortune.,"“From across the hall, you see a finger, bedecked in fine rings, pointing at you.”",,,,,,,,,,,,,,,,,,,,
Deeproot Defender,A burly vegetable-person with grasping vines,"Ambush, Grab, Protect, Pummel",Bruiser,1,10,2,Vines,Close,2d8+7,phy,8,14,7,3,Huge +3,Ground Slam,Action,"Slam the ground, knocking any targets within Very Close range into Far range. Each character knocked back this way marks Stress.","“Their fists slam to the ground, and the shockwave sends you flying.”",Grab and Drag,Action,"Make an attack roll against a close target. On a success, spend a Fear to pull them into melee, deal 2d8+3 phy damage, and make them Restrained. This condition ends the next time the bruiser takes Severe Damage.","“They reach out with their vines and ensnare you, pulling you in.”",,,,,,,,,,,,,,,,,,,,
Dire Wolf,"A large wolf with menacing teeth, seldom encountered alone.","Defend Territory, Harry, Protect Pack, Surround, Trail",Skulk,1,12,2,Claws,Melee,2d6+3,phy,5,9,4,2,Keen Senses +3,Pack Tactics,Passive,"When making a Claws attack, if another Dire Wolf is also in melee range of the target, deal 2d6+8 phy damage instead.","“When they work in packs, they’re more bold, more vicious.”",Hobbling Strike,Action,"Make an attack against a target in melee range. On a success, mark a Stress to deal 3d4+10 phy damage and make them Vulnerable until they heal a Hit Point.","“With a snarl, they lunge at you, sinking their teeth in deep.”",,,,,,,,,,,,,,,,,,,,
Giant Mosquitos,"Dozens of fist-sized mosquitoes, flying together for protection.","Harass, Steal Blood, Fly Away",Horde (5/HP),1,10,-2,Proboscis,Melee,2d8+5,phy,5,9,6,3,Camouflage +2,Flying,Passive,Cannot be targeted by effects that impact balance or the ground. +2 Difficulty when at least a Very Close distance off the ground.,“The swarm nimbly maneuvers around your blows.”,Bloodsucker,Reaction,Mark Stress when an attack by Giant Mosquitos causes a character to mark HP. They must mark +1 HP.,,Horde 2d4+2,Passive,"If Giant Mosquito swarm has marked half or more of their HP, they deal 2d4+2 phy damage instead of their normal damage.",,,,,,,,,,,,,,,,,
Giant Rat,A cat-sized rodent skilled at scavenging and survival.,"Burrow, Scavenge, Hunger, Wear Down",Minion,1,10,-4,Claws,Melee,3,phy,,,1,1,Keen Senses +3,Minion (3),Passive,"This adversary is defeated if they take any damage. For every 3 damage a PC deals to this adversary, defeat an additional minion in the attack’s range.","“You cut through them effortlessly, one to the next.”",Group Attack,Action (2),"Choose a target and activate all Giant Rats within Close range of them. Those minions move into melee with the target and make one shared attack roll. On a success, they deal 3 phy damage each. Combine this damage together.","“They descend on you, stronger together.”",,,,,,,,,,,,,,,,,,,,
Giant Scorpion,A human-sized insect with tearing claws and a stinging tail.,"Ambush, Feed, Grapple, Poison",Bruiser,1,13,1,Pincers,Melee,2d8+5,phy,7,13,6,3,Camouflage +2,Double Strike,Action,"Mark a Stress to make a Pincers attack against two targets within range. On a success, deal 2d8+5 phy damage to each.",“Their massive claws strike out at both of you.”,Venomous Stinger,Action,"Make an attack against a target within Very Close range. On a success, spend a Fear to deal 3d4+10 phy damage and Envenomate them. While Envenomated, before they make an action roll, they must roll a d6. If the result is a 4 or below, they mark a stress. Envenomated clears at their next short rest or on a successful Knowledge (16) roll.",“You feel the hot venom rush through your veins.”,,,,,,,,,,,,,,,,,,,,
Glass Snake,A clear serpent with a head the size of a human that leaves behind a glass shard trail wherever it goes.,"Climb, Feed, Keep Distance, Scare",Standard,1,14,2,Glass Fangs,Very Close,1d8+5,phy,6,10,5,3,,Armor Shredding Shards,Passive,Any successful melee attacks against this creature also mark an armor slot on the attacker.,"“Though the strike hits true, its glass scales shred your armor.”",Spinning Serpent,Action,Mark a Stress to make an attack against all targets within Very Close range. Any target hit takes 1d8+5 phy damage.,"“It spins violently, its sharp body striking in every direction.”",Spitter,Action,"Spend a Fear to introduce a Spitter d6 die. Anytime the Glass Snake activates, roll this die. On a 5+, all targets in front of the snake within Far range must succeed on an Agility Reaction Roll or take 2d6+3 damage. This does not use the snake’s activation.",“Hundreds of shards of pearlescent glass spiral towards you.”,,,,,,,,,,,,,,,,
Green Ooze,A moving mound of translucent green slime.,"Creep up, Envelop, Camouflage, Consume & Multiply",Skulk,1,8,1,Ooze Appendage,Melee,1d6+2,mag,5,10,5,2,Camouflage +3,Slow (2),Passive,The GM must spend two tokens to activate this adversary.,"“They take a moment to react, and you can tell they’re not as quick as you are.”",Acidic Form,Passive,Any successful melee attacks this creature makes also marks an Armor Slot on the target. This doesn’t reduce any damage.,"“The residue eats away at your armor, corroding it slowly.”",Envelop,Action,"Make an attack against a target in melee. On a success, envelop them, immediately dealing 2 Stress. Every time an action token is placed on the tracker, deal an additional Stress. They will break free the next time the ooze takes Severe damage.","“The ooze encircles you, drawing you into its gelatinous form.”",Split,Reaction,"When this adversary marks its 3rd Hit Point, spend a Fear to split it into two Tiny Green Oozes (with no marked Hit Points or Stress). They may immediately activate without spending tokens.",“You watch as the damage you’ve done splits it in half… becoming two oozes instead of one.”,,,,,,,,,,,,
Harrier,A nimble fighter armed with javelins.,"Harry, Kite, Flank, Profit",Standard,1,12,1,Javelin,Close,1d8+7,phy,5,9,3,3,Camouflage +2,Maintain Distance,Passive,"After making an attack, Harrier may move anywhere within Far range.","“They move with purpose across the battlefield, away from the fray.”",Fall Back,Reaction,"When a PC moves into melee to make an attack, Harrier may mark a Stress before the attack roll to move anywhere within Close range and make a Javelin attack on them. A success deals 1d8+7 phy damage.","“They won’t let you get close, instead turning an attack back on you.”",,,,,,,,,,,,,,,,,,,,
Head Guard,"A seasoned guard with a mace, whistle, and a bellowing voice.","Command, Close Gates, Pin Down, Arrest, Seek Glory",Leader,1,15,4,Mace,Melee,2d6+8,phy,7,13,7,2,"Commander +2, Local Knowledge +2",Rally Guards,Action,"Fear Spend a Fear to activate Head Guard and up to 2d4 allies with Far range, without spending additional action tokens.",,On My Signal,Reaction,"Countdown (5) Activate when this creature sees any number of hostile targets. It ticks down anytime a PC makes an attack roll. When triggered, all Archer Guards within Far range fire at their nearest target with advantage. If any hit the same target, add their damage together.","“With the wave of a hand, a rain of arrows falls down upon you.”",,,,,,,,,,,,,,,,,,,,
Jagged Knife Bandit,A cunning criminal in a heavy cloak bearing one of the gang’s iconic knives.,"Escape, Profit, Throw Smoke",Standard,1,12,1,Daggers,Melee,2d6+3,phy,8,14,5,3,Bandit +2,Climber,Passive,This adversary can climb just as easily as they can run.,“They get to higher ground.”,From Above,Action,"Make an attack from above a target. On a success, deal 3d4+10 physical damage.",“They drop in from above and take no mercy.”,,,,,,,,,,,,,,,,,,,,
Jagged Knife Hexer,"A staff-wielding bandit in a cloak, adorned with magical paraphernalia, using curses to vex their foes.","Command, Hex, Profit, Warp",Support,1,13,2,Staff,Far,1d8+5,mag,5,9,4,4,Magical Knowledge +2,Curse,Action,"Target a creature within Far range and make them Cursed. While Cursed, on any rolls made with Hope, this adversary can mark a Stress to make it with Fear instead.","“A wave of nausea passes over you, as you realize you’ve been cursed.”",Chaotic Flux,Action,Make an attack against up to three targets within Very Close range. Mark a Stress to deal 2d6+3 magic damage to any you are successful against.,“They unleash a flurry of writhing magic in all directions.”,,,,,,,,,,,,,,,,,,,,
Jagged Knife Kneebreaker,An imposing brawler carrying a large club.,"Intimidate, Grapple, Profit, Steal",Bruiser,1,12,-3,Club,Melee,3d4+10,phy,7,14,7,4,"Bandit +2, Unveiled Threats +3",I’ve Got ‘Em,Passive,Characters Restrained by this adversary take double damage from attacks by other adversaries in the scene.,“They have you pinned and you know that’s bad news.”,Hold Them Down,Action,"Make an attack against a target in melee. On a success, they take no damage but are Restrained and Vulnerable. A PC can break free by with Strength (12) roll or are let go automatically when Major damage or higher is dealt to the Bruiser.",“They slam you to the ground with unbelievable strength.”,,,,,,,,,,,,,,,,,,,,
Jagged Knife Lackey,"A commonly-dressed thief with small daggers, eager to prove themselves.","Escape, Profit, Throw Smoke",Minion,1,9,-2,Daggers,Melee,3,phy,,,1,1,Bandit +2,Minion (3),Passive,"This adversary is defeated if they take any damage. For every 3 damage a PC deals to this adversary, defeat an additional minion in the attack’s range.","“You cut through them effortlessly, one to the next.”",Group Attack,Action (2),"Choose a target and activate all Jagged Knife Lackeys within Close range of them. Those minions move into melee with the target and make one shared attack roll. On a success, they deal 3 phy damage each. Combine this damage together.","“They descend on you, stronger together.”",,,,,,,,,,,,,,,,,,,,
Jagged Knife Lieutenant,A seasoned bandit in quality leathers with a strong voice and cunning eyes.,"Bully, Command, Profit, Reinforce",Leader,1,13,2,Javelin,Close,2d6+8,phy,7,14,6,3,Area Knowledge +2,Tactician,Action,Mark a Stress to activate this adversary and two allies within Close range of them (do not spend additional action tokens for the allies).,"“They give the orders, and they’re followed without hesitation.”",More Where That Came From,Action,"Summon 3 Jagged Knife Lackeys, who appear at Far range.",“You see more trouble headed your way.”,Coup de Grace,Action,"Spend a Fear to make an attack against a Vulnerable target within Close range. If successful, deal 2d6+12 phy damage and force the target to mark a Stress.",“They see you struggling and move to end this.”,,,,,,,,,,,,,,,,
Jagged Knife Shadow,A nimble scoundrel bearing a wicked knife and utilizing shadow magic to isolate targets.,"Ambush, Conceal, Divide, Profit",Skulk,1,12,1,Daggers,Melee,2d4+5,phy,4,8,3,3,Intrusion +3,Backstab,Passive,"On a successful Daggers attack that has advantage, deal 2d6+8 phy damage instead.",“They exploit your weakness and hit you where it hurts.”,Cloaked,Action,Become Hidden until after this adversary’s next attack. Any attacks made while Hidden have advantage.,“They can disappear in plain sight.”,,,,,,,,,,,,,,,,,,,,
Jagged Knife Sniper,A lanky bandit striking from cover with a shortbow.,"Hide, Ambush, Profit, Reposition",Ranged,1,13,-1,Shortbow,Far,2d6+3,phy,4,7,3,2,Stealth +2,Unseen Strike,Passive,"If the Sniper is Hidden when they hit an enemy, the attack deals 2d8+5 phy instead of their normal damage.","“From the shadows, an arrow with deadly aim flies towards you.”",,,,,,,,,,,,,,,,,,,,,,,,
Merchant,A finely dressed trader with a keen eye for profit.,"Buy Low/Sell High, Create Demand, Inflate Prices, Seek Profit",Social,1,10,-4,Club,Melee,1d4+1,phy,4,8,3,3,Shrewd Negotiator +5,Preferential Treatment,Passive,A character that succeeds at a social action against the Merchant gains a discount on purchases. Any character that fails on a social action against the merchant must pay more and is at disadvantage on future social actions against the Merchant.,“There’s an added service fee for enemies.”,The Run-Around,Passive,Any Presence roll made against the Merchant below 15 causes the character to mark a Stress.,“You can’t swindle a professional swindler.”,,,,,,,,,,,,,,,,,,,,
Minor Chaos Elemental,A coruscating mass of uncontrollable magic.,"Confound, Destabilize, Transmogrify",Solo,1,14,3,Warp Blast,Close,2d10,mag,7,14,6,3,,Arcane Form,Passive,This adversary is resistant to magic damage.,“You watch as some of your magic is reflected off of the chaos.”,Magical Reflection,Reaction,"When this adversary takes damage, deal half that damage to the attacker if they are within Close range.","“The harder you hit it, the more force is blasted back at you.”",Sickening Flux,Action,Mark a Hit Point to cause all PCs within Close range to mark a Stress and become Vulnerable until their next short rest or they have a Stress cleared.,“Your stomach drops and your head swims.”,Remake Reality,Action,Spend a Fear to transform the area within Very Close range into a different biome. Any other creature within this area takes 2d6+3 direct damage.,"“You feel the world twist around you, your mind reeling.”",,,,,,,,,,,,
Minor Demon,"A crimson-hued creature from the realms below, consumed by rage against all mortals.","Torment, Corral Targets, Relish Pain, Act Erratically",Solo,1,14,3,Claws,Melee,2d6+6,phy,8,15,7,4,,Relentless (2),Passive,This adversary may activate twice in a GM move.,“They move with incredible speed.”,All Must Fall,Passive,Any PC that rolls a failure with Fear within a Close distance of Minor Demon loses Hope.,“Light around you seems to dim as the fight becomes more dire.”,Reaper,Reaction,"When rolling damage, mark a Stress to add the Demon’s current number of marked Hit Points to the value of the damage inflicted.","“As hard as you’ve hit, the demon hits back harder.”",Hellfire,Action,Fear Spend a Fear to rain hellfire on everything within Far range. All targets within the area must make an Agility Reaction Roll (14) or take 3d4+12 mag damage. Targets that succeed take half damage.,“You smell smoke as the sky above you fills with streaks of fire.”,,,,,,,,,,,,
Minor Fire Elemental,A living flame the size of a large bonfire.,"Start Fires, Encircle Enemies, Grow in Size, Intimidate",Solo,1,13,3,Elemental Blast,Far,3d6,mag,7,15,7,3,,Relentless (2),Passive,This adversary may activate twice in a GM move.,“They move with incredible speed.”,Consume Kindling,Reaction,"When you move onto any objects that are highly flammable, consume them to clear 1 HP or 1 Stress. You may do this three times a scene.","“The Elemental spits with fire, consuming the barrels beneath it, growing stronger.”",Scorched Earth,Action,"Mark a Stress to choose a point within Far range. The ground within Very Close range of that point immediately bursts into flames. Anyone within this area must make an Agility Reaction Roll (13), or take 2d6+5 magic damage from the flames. On a success, they take half damage instead.","“The ground glows red hot around you, suddenly bursting into flames.”",Explosion,Action,Spend a Fear to erupt in a fiery explosion. Make an attack against all targets within Close range. Any you succeed against are thrown back to Far range and take 3d4+10 mag damage. Armor is half as effective against this damage.,"“A massive, fiery explosion rocks the battlefield.”",,,,,,,,,,,,
Minor Treant,An ambulatory sapling rising up to defend their forest.,"Crush, Overwhelm, Protect",Minion,1,10,-2,Clawed Branch:,Melee,4,phy,,,1,1,Nature’s Friend +1,Minion (4),Passive,"This adversary is defeated if they take any damage. For every 4 damage a PC deals to this adversary, defeat an additional minion in the attack’s range.","“You cut through them effortlessly, one to the next.”",Group Attack,Action (2),"Choose a target and activate all Minor Treants within Close range of them. Those minions move into melee with the target and make one shared attack roll. On a success, they each deal 4 phy damage.","“They descend on you, stronger together.”",,,,,,,,,,,,,,,,,,,,
Patchwork Zombie Hulk,"A towering gestalt of corpses moving as one, with torso-sized limbs and fists as large as a grown halfling.","Hunger, Flail, Absorb Corpses, Terrify",Solo,1,13,4,Too Many Arms,Very Close,3d4+10,phy,8,15,9,3,"Tear Things Apart +2, Intimidation +2",Destructible,Passive,"Whenever Patchwork Zombie takes Major damage or worse, it marks +1 HP.","“Your blows land harder than expected, limbs and torsos falling from the creature.”",Flailing Limbs,Passive,"When Patchwork Zombie Hulk makes an attack, it targets all opponents within Very Close range.","“It attacks in every direction, torso-sized limbs flailing.”",Another For The Pile,Action,"If the Patchwork Zombie Hulk is within Very Close of a corpse, it presses the cadaver to itself and incorporates it into the Hulk’s form, healing 1 HP and clearing 1 Stress.","“The hulk grabs the dead and swallows them, replacing some of its wounds and growing more energetic.”",Tormented Screams,Action,Mark Stress to cause all PCs within Far range to make a reaction roll (Presence 13) or lose a Hope and add a token to the action tracker. PCs that succeed mark Stress instead.,,,,,,,,,,,,,
Petty Noble,A richly-dressed and adorned aristocrat brimming with hubris.,"Gather Resources, Mobilize Minions, Abuse Power",Social,1,12,-3,Rapier,Melee,2d4+2,phy,6,10,3,5,Aristocrat +5,"My Land, My Rules",Passive,All social actions against the Petty Noble on their land are made at disadvantage.,“You’re a guest in my home!”,"Guards, Seize Them!",Action,"Once per scene, mark a Stress to summon 1d4 Bladed Guards to enforce the Noble’s will.",“You had no idea the suits of armor lining the hall were guards.”,Exile,Action,"Fear Petty Noble proclaims that a PC and their close associates are exiled from the noble’s territory. While exiled, the target has disadvantage in all social situations within the Noble’s domain.",“Be gone!”,,,,,,,,,,,,,,,,
